<?xml version="1.0" encoding="UTF-8"?>

<!ELEMENT students (student+)>
<!ELEMENT student (rollno,name,dept) >
<!ELEMENT rollno (#PCDATA) >
<!ELEMENT name (#PCDATA) >
<!ELEMENT dept (#PCDATA) >

